{
  "version": 1,
  "entries": [],
  "destinations": [
    {
      "id": "health-primary",
      "url": "https://primary.example.com/health",
      "method": "POST",
      "format": "json",
      "auth": ""
    },
    {
      "id": "health-secondary",
      "url": "https://secondary.example.com/health",
      "method": "POST",
      "format": "json",
      "auth": ""
    }
  ],
  "actions": [],
  "flows": [],
  "monitors": [
    {
      "id": "cpu-a",
      "metric": "cpu",
      "threshold": 90,
      "recovery": 75,
      "duration_seconds": 60,
      "recovery_duration_seconds": 30,
      "interval_seconds": 10,
      "cooldown_seconds": 300,
      "enabled": false
    },
    {
      "id": "cpu-b",
      "metric": "cpu",
      "threshold": 80,
      "recovery": 65,
      "duration_seconds": 60,
      "recovery_duration_seconds": 30,
      "interval_seconds": 10,
      "cooldown_seconds": 300,
      "enabled": false
    },
    {
      "id": "memory-a",
      "metric": "memory",
      "threshold": 90,
      "recovery": 75,
      "duration_seconds": 60,
      "recovery_duration_seconds": 30,
      "interval_seconds": 10,
      "cooldown_seconds": 300,
      "enabled": false
    },
    {
      "id": "memory-b",
      "metric": "memory",
      "threshold": 85,
      "recovery": 70,
      "duration_seconds": 60,
      "recovery_duration_seconds": 30,
      "interval_seconds": 10,
      "cooldown_seconds": 300,
      "enabled": false
    },
    {
      "id": "disk-a",
      "metric": "disk",
      "path": "/",
      "threshold": 10,
      "recovery": 15,
      "duration_seconds": 60,
      "recovery_duration_seconds": 30,
      "interval_seconds": 10,
      "cooldown_seconds": 300,
      "enabled": false
    },
    {
      "id": "disk-b",
      "metric": "disk",
      "path": "/home",
      "threshold": 15,
      "recovery": 25,
      "duration_seconds": 60,
      "recovery_duration_seconds": 30,
      "interval_seconds": 10,
      "cooldown_seconds": 300,
      "enabled": false
    },
    {
      "id": "battery-a",
      "metric": "battery",
      "threshold": 15,
      "recovery": 25,
      "duration_seconds": 60,
      "recovery_duration_seconds": 30,
      "interval_seconds": 10,
      "cooldown_seconds": 300,
      "enabled": false
    },
    {
      "id": "battery-b",
      "metric": "battery",
      "threshold": 25,
      "recovery": 40,
      "duration_seconds": 60,
      "recovery_duration_seconds": 30,
      "interval_seconds": 10,
      "cooldown_seconds": 300,
      "enabled": false
    },
    {
      "id": "service-a",
      "metric": "service",
      "unit": "backup.service",
      "threshold": 50,
      "recovery": 75,
      "duration_seconds": 60,
      "recovery_duration_seconds": 30,
      "interval_seconds": 10,
      "cooldown_seconds": 300,
      "enabled": false
    },
    {
      "id": "service-b",
      "metric": "service",
      "unit": "worker.service",
      "threshold": 25,
      "recovery": 90,
      "duration_seconds": 60,
      "recovery_duration_seconds": 30,
      "interval_seconds": 10,
      "cooldown_seconds": 300,
      "enabled": false
    },
    {
      "id": "process-a",
      "metric": "process",
      "path": "/usr/bin/python3",
      "threshold": 50,
      "recovery": 75,
      "duration_seconds": 60,
      "recovery_duration_seconds": 30,
      "interval_seconds": 10,
      "cooldown_seconds": 300,
      "enabled": false
    },
    {
      "id": "process-b",
      "metric": "process",
      "path": "/usr/bin/bash",
      "threshold": 25,
      "recovery": 90,
      "duration_seconds": 60,
      "recovery_duration_seconds": 30,
      "interval_seconds": 10,
      "cooldown_seconds": 300,
      "enabled": false
    },
    {
      "id": "file-exists-a",
      "metric": "file_exists",
      "path": "/home/USER/reports/ready.json",
      "threshold": 50,
      "recovery": 75,
      "duration_seconds": 60,
      "recovery_duration_seconds": 30,
      "interval_seconds": 10,
      "cooldown_seconds": 300,
      "enabled": false
    },
    {
      "id": "file-exists-b",
      "metric": "file_exists",
      "path": "/home/USER/backups/latest.tar",
      "threshold": 25,
      "recovery": 90,
      "duration_seconds": 60,
      "recovery_duration_seconds": 30,
      "interval_seconds": 10,
      "cooldown_seconds": 300,
      "enabled": false
    },
    {
      "id": "file-age-a",
      "metric": "file_age",
      "path": "/home/USER/reports/ready.json",
      "threshold": 3600,
      "recovery": 300,
      "duration_seconds": 60,
      "recovery_duration_seconds": 30,
      "interval_seconds": 10,
      "cooldown_seconds": 300,
      "enabled": false
    },
    {
      "id": "file-age-b",
      "metric": "file_age",
      "path": "/home/USER/backups/latest.tar",
      "threshold": 86400,
      "recovery": 3600,
      "duration_seconds": 60,
      "recovery_duration_seconds": 30,
      "interval_seconds": 10,
      "cooldown_seconds": 300,
      "enabled": false
    },
    {
      "id": "file-size-a",
      "metric": "file_size",
      "path": "/home/USER/reports/output.log",
      "threshold": 104857600,
      "recovery": 52428800,
      "duration_seconds": 60,
      "recovery_duration_seconds": 30,
      "interval_seconds": 10,
      "cooldown_seconds": 300,
      "enabled": false
    },
    {
      "id": "file-size-b",
      "metric": "file_size",
      "path": "/home/USER/reports/output.json",
      "threshold": 10485760,
      "recovery": 5242880,
      "duration_seconds": 60,
      "recovery_duration_seconds": 30,
      "interval_seconds": 10,
      "cooldown_seconds": 300,
      "enabled": false
    },
    {
      "id": "connectivity-a",
      "metric": "connectivity",
      "destination": "health-primary",
      "threshold": 50,
      "recovery": 75,
      "duration_seconds": 60,
      "recovery_duration_seconds": 30,
      "interval_seconds": 10,
      "cooldown_seconds": 300,
      "enabled": false
    },
    {
      "id": "connectivity-b",
      "metric": "connectivity",
      "destination": "health-secondary",
      "threshold": 25,
      "recovery": 90,
      "duration_seconds": 60,
      "recovery_duration_seconds": 30,
      "interval_seconds": 10,
      "cooldown_seconds": 300,
      "enabled": false
    },
    {
      "id": "temperature-a",
      "metric": "temperature",
      "path": "/sys/class/thermal/thermal_zone0/temp",
      "threshold": 80,
      "recovery": 65,
      "duration_seconds": 60,
      "recovery_duration_seconds": 30,
      "interval_seconds": 10,
      "cooldown_seconds": 300,
      "enabled": false
    },
    {
      "id": "temperature-b",
      "metric": "temperature",
      "path": "/sys/class/hwmon/hwmon0/temp1_input",
      "threshold": 75,
      "recovery": 60,
      "duration_seconds": 60,
      "recovery_duration_seconds": 30,
      "interval_seconds": 10,
      "cooldown_seconds": 300,
      "enabled": false
    },
    {
      "id": "journal-a",
      "metric": "journal",
      "unit": "backup.service",
      "priority": 3,
      "threshold": 0,
      "recovery": 0,
      "duration_seconds": 60,
      "recovery_duration_seconds": 30,
      "interval_seconds": 10,
      "cooldown_seconds": 300,
      "enabled": false
    },
    {
      "id": "journal-b",
      "metric": "journal",
      "unit": "worker.service",
      "priority": 4,
      "threshold": 0,
      "recovery": 0,
      "duration_seconds": 60,
      "recovery_duration_seconds": 30,
      "interval_seconds": 10,
      "cooldown_seconds": 300,
      "enabled": false
    }
  ],
  "timers": []
}
